{
  "schema_version": 1,
  "generated_at": "2026-08-21T00:00:00Z",
  "valid_until": "2030-08-22T00:00:00Z",
  "products": [
    {"public_id":"A1b2C3d4E5f6G7h8J9k0Lm","slug":"modular-desk-organizer","title":"Modular Desk Organizer","description":"Stackable trays for pens, notes, and small desk accessories.","category":"Office","tags":["desk","organizer","storage"],"images":[{"url":"https://images.example.com/catalog/desk-organizer.jpg","alt":"Modular desk organizer"}],"attributes":{"material":"bamboo","width_cm":24},"price":{"amount":24.9,"currency":"USD","tier":"tier_a"},"availability_band":"in_stock","lead_time_days":5,"source":"published_fixture","purchasable":true},
    {"public_id":"B2c3D4e5F6g7H8j9K0m1Np","slug":"compact-garden-trowel","title":"Compact Garden Trowel","description":"A stainless garden tool for balcony and container planting.","category":"Garden","tags":["garden","tool","balcony"],"images":[{"url":"https://images.example.com/catalog/garden-trowel.jpg","alt":"Compact garden trowel"}],"attributes":{"material":"stainless steel","length_cm":29},"price":{"amount":12.5,"currency":"USD","tier":"tier_a"},"availability_band":"in_stock","lead_time_days":4,"source":"published_fixture","purchasable":true},
    {"public_id":"C3d4E5f6G7h8J9k0L1m2Pq","slug":"wooden-building-blocks","title":"Wooden Building Blocks","description":"Smooth geometric blocks for open-ended construction play.","category":"Toys","tags":["toy","blocks","wooden"],"images":[{"url":"https://images.example.com/catalog/wooden-blocks.jpg","alt":"Wooden building blocks"}],"attributes":{"pieces":48,"material":"beech"},"price":{"amount":31,"currency":"USD","tier":"tier_a"},"availability_band":"low","lead_time_days":7,"source":"published_fixture","purchasable":true},
    {"public_id":"D4e5F6g7H8j9K0m1N2p3Qr","slug":"travel-cable-pouch","title":"Travel Cable Pouch","description":"A compact zip pouch with elastic loops for charging cables.","category":"Travel","tags":["travel","cable","pouch"],"images":[{"url":"https://images.example.com/catalog/cable-pouch.jpg","alt":"Travel cable pouch"}],"attributes":{"material":"recycled polyester","weight_g":180},"price":{"amount":18.75,"currency":"USD","tier":"tier_a"},"availability_band":"in_stock","lead_time_days":5,"source":"published_fixture","purchasable":true},
    {"public_id":"E5f6G7h8J9k0L1m2P3q4Rs","slug":"insulated-lunch-tote","title":"Insulated Lunch Tote","description":"A wipe-clean lunch tote with a wide top opening.","category":"Kitchen","tags":["lunch","insulated","tote"],"images":[{"url":"https://images.example.com/catalog/lunch-tote.jpg","alt":"Insulated lunch tote"}],"attributes":{"capacity_l":8,"material":"polyester"},"price":{"amount":21.4,"currency":"USD","tier":"tier_a"},"availability_band":"in_stock","lead_time_days":6,"source":"published_fixture","purchasable":true},
    {"public_id":"F6g7H8j9K0m1N2p3Q4r5St","slug":"ceramic-plant-mister","title":"Ceramic Plant Mister","description":"A small ceramic mister for indoor plants and seedlings.","category":"Home","tags":["plant","mister","ceramic"],"images":[{"url":"https://images.example.com/catalog/plant-mister.jpg","alt":"Ceramic plant mister"}],"attributes":{"capacity_ml":320,"material":"ceramic"},"price":{"amount":16.2,"currency":"USD","tier":"tier_b"},"availability_band":"in_stock","lead_time_days":5,"source":"published_fixture","purchasable":true},
    {"public_id":"G7h8J9k0L1m2P3q4R5s6Tu","slug":"folding-laptop-stand","title":"Folding Laptop Stand","description":"An adjustable aluminum stand that folds flat for travel.","category":"Office","tags":["laptop","stand","portable"],"images":[{"url":"https://images.example.com/catalog/laptop-stand.jpg","alt":"Folding laptop stand"}],"attributes":{"material":"aluminum","weight_g":620},"price":{"amount":29.9,"currency":"USD","tier":"tier_b"},"availability_band":"low","lead_time_days":8,"source":"published_fixture","purchasable":true},
    {"public_id":"H8j9K0m1N2p3Q4r5S6t7Uv","slug":"reusable-produce-bags","title":"Reusable Produce Bags","description":"A set of washable mesh bags with drawstring closures.","category":"Kitchen","tags":["reusable","produce","bags"],"images":[{"url":"https://images.example.com/catalog/produce-bags.jpg","alt":"Reusable produce bags"}],"attributes":{"pieces":6,"material":"polyester mesh"},"price":{"amount":13.8,"currency":"USD","tier":"tier_b"},"availability_band":"in_stock","lead_time_days":4,"source":"published_fixture","purchasable":true},
    {"public_id":"J9k0L1m2P3q4R5s6T7u8Vw","slug":"portable-pet-water-bottle","title":"Portable Pet Water Bottle","description":"A leak-resistant travel bottle with an integrated drinking tray.","category":"Pets","tags":["pet","water","travel"],"images":[{"url":"https://images.example.com/catalog/pet-water-bottle.jpg","alt":"Portable pet water bottle"}],"attributes":{"capacity_ml":480,"material":"stainless steel"},"price":{"amount":22.6,"currency":"USD","tier":"tier_b"},"availability_band":"in_stock","lead_time_days":6,"source":"published_fixture","purchasable":true},
    {"public_id":"K0m1N2p3Q4r5S6t7U8v9Wx","slug":"soft-reading-light","title":"Soft Reading Light","description":"A rechargeable clip light with warm and neutral brightness modes.","category":"Home","tags":["reading","light","rechargeable"],"images":[{"url":"https://images.example.com/catalog/reading-light.jpg","alt":"Soft reading light"}],"attributes":{"battery_mah":1000,"weight_g":95},"price":{"amount":17.9,"currency":"USD","tier":"tier_b"},"availability_band":"in_stock","lead_time_days":5,"source":"published_fixture","purchasable":true},
    {"public_id":"L1m2P3q4R5s6T7u8V9w0Xy","slug":"canvas-tool-roll","title":"Canvas Tool Roll","description":"A waxed canvas roll with divided pockets and tie closure.","category":"Tools","tags":["tool","roll","canvas"],"images":[{"url":"https://images.example.com/catalog/tool-roll.jpg","alt":"Canvas tool roll"}],"attributes":{"pockets":10,"material":"waxed canvas"},"price":{"amount":26.5,"currency":"USD","tier":"tier_b"},"availability_band":"out_of_stock","lead_time_days":14,"source":"published_fixture","purchasable":false},
    {"public_id":"M2p3Q4r5S6t7U8v9W0x1Yz","slug":"compact-picnic-blanket","title":"Compact Picnic Blanket","description":"A water-resistant blanket that folds into a handled pouch.","category":"Outdoor","tags":["picnic","blanket","outdoor"],"images":[{"url":"https://images.example.com/catalog/picnic-blanket.jpg","alt":"Compact picnic blanket"}],"attributes":{"width_cm":145,"length_cm":180},"price":{"amount":34.2,"currency":"USD","tier":"tier_b"},"availability_band":"in_stock","lead_time_days":7,"source":"published_fixture","purchasable":true}
  ],
  "tenant_scopes": {
    "tenant_alpha": {"product_ids":["A1b2C3d4E5f6G7h8J9k0Lm","B2c3D4e5F6g7H8j9K0m1Np","C3d4E5f6G7h8J9k0L1m2Pq","D4e5F6g7H8j9K0m1N2p3Qr","E5f6G7h8J9k0L1m2P3q4Rs"],"price_tier":"tier_a","allow_full_enumeration":false},
    "tenant_beta": {"product_ids":["F6g7H8j9K0m1N2p3Q4r5St","G7h8J9k0L1m2P3q4R5s6Tu","H8j9K0m1N2p3Q4r5S6t7Uv","J9k0L1m2P3q4R5s6T7u8Vw","K0m1N2p3Q4r5S6t7U8v9Wx","L1m2P3q4R5s6T7u8V9w0Xy","M2p3Q4r5S6t7U8v9W0x1Yz"],"price_tier":"tier_b","allow_full_enumeration":false}
  }
}
